{
  "classes": [
    {
      "class_name": "code",
      "modifiers": [
        "public"
      ],
      "fields": [],
      "methods": [
        "bubbleSort",
        "printArray",
        "main"
      ],
      "constructors": [],
      "enclosing_class": [],
      "nested_classes_or_interfaces": [],
      "super_class": [
        "Object"
      ],
      "implemented_interfaces": [],
      "sub_class": [],
      "dependencies": {
        "inherited_methods": [
          "toString",
          "equals",
          "hashCode",
          "getClass",
          "wait",
          "notify",
          "notifyAll"
        ],
        "overridden_methods": [],
        "interface_implementations": [],
        "field_dependencies": [],
        "method_dependencies": [
          {
            "method": "bubbleSort",
            "calls": [
              "printArray"
            ]
          },
          {
            "method": "printArray",
            "calls": []
          },
          {
            "method": "main",
            "calls": [
              "printArray",
              "bubbleSort"
            ]
          }
        ]
      },
      "description": "This class contains methods for sorting an array using bubble sort and printing the array.",
      "first_Pass_Analysis": "This Java class implements bubble sort and array printing methods, providing basic array manipulation functionality.",
      "second_Pass_Analysis": "### Detailed Analysis of the Java Component\n\n#### Overview\n\nThe provided Java component, named `code`, is a public class that implements basic array manipulation functionality. It contains methods for sorting an array using bubble sort and printing the array.\n\n#### Class Structure\n\n* **Class Name:** `code`\n* **Modifiers:** `public`\n* **Fields:** None\n* **Methods:**\n\t+ `bubbleSort`: sorts an array using the bubble sort algorithm\n\t+ `printArray`: prints the elements of an array\n\t+ `main`: the entry point of the program, calls `printArray` and `bubbleSort` methods\n* **Constructors:** None\n* **Enclosing Class:** None\n* **Nested Classes/Interfaces:** None\n* **Super Class:** `Object`\n* **Implemented Interfaces:** None\n* **Sub Class:** None\n\n#### Method Dependencies\n\nThe methods in this class have the following dependencies:\n\n* `bubbleSort` calls `printArray`\n* `printArray` does not call any other methods\n* `main` calls both `printArray` and `bubbleSort`\n\n#### Inherited Methods\n\nAs a subclass of `Object`, this class inherits the following methods:\n\n* `toString`\n* `equals`\n* `hashCode`\n* `getClass`\n* `wait`\n* `notify`\n* `notifyAll`\n\n#### Analysis\n\nBased on the provided information, this Java class provides basic array manipulation functionality through its `bubbleSort` and `printArray` methods. The `main` method serves as the entry point of the program and demonstrates the usage of these methods.\n\nThe `bubbleSort` method sorts an array using the bubble sort algorithm, which is a simple sorting algorithm that repeatedly steps through the list, compares adjacent elements, and swaps them if they are in the wrong order. The `printArray` method simply prints the elements of an array.\n\nThe method dependencies indicate that the `bubbleSort` method relies on the `printArray` method to print the sorted array, and the `main` method calls both `printArray` and `bubbleSort` to demonstrate their usage.\n\nOverall, this Java class provides a basic implementation of array sorting and printing functionality, making it a useful component for simple array manipulation tasks.\n\n#### Example Use Cases\n\n* Sorting an array of integers in ascending order\n* Printing the elements of an array\n* Demonstrating the usage of bubble sort algorithm\n\n#### Code Improvements\n\n* Consider adding more advanced sorting algorithms, such as quicksort or mergesort, for larger datasets\n* Add error handling for cases like null or empty arrays\n* Consider adding more methods for array manipulation, such as searching or inserting elements\n\nNote: The implementation of the class is not provided, so the analysis is based on the given information about the class structure, method dependencies, and inherited methods."
    }
  ],
  "interfaces": [],
  "methods": [
    {
      "method_name": "bubbleSort",
      "modifiers": [
        "public",
        "static"
      ],
      "return_type": "void",
      "parameters": [
        {
          "name": "arr",
          "type": "int[]"
        }
      ],
      "throws": [],
      "enclosing_class": [
        "code"
      ],
      "dependencies": {
        "called_methods": [],
        "used_fields": [],
        "overrides": "",
        "implements": ""
      },
      "description": "This method sorts an array using bubble sort.",
      "first_Pass_Analysis": "This Java method implements the bubble sort algorithm, sorting an integer array in ascending order using repeated comparisons and swaps.",
      "second_Pass_Analysis": "### Detailed Analysis of the Java Component\n\n#### Overview\n\nThe provided Java component, named `bubbleSort`, is a public static method that implements the bubble sort algorithm, sorting an integer array in ascending order using repeated comparisons and swaps.\n\n#### Method Structure\n\n* **Method Name:** `bubbleSort`\n* **Modifiers:** `public`, `static`\n* **Return Type:** `void`\n* **Parameters:** `arr: int[]`\n* **Throws:** None\n* **Enclosing Class:** `code`\n\n#### Method Dependencies\n\nThe method has the following dependencies:\n\n* **Called Methods:** None\n* **Used Fields:** None\n* **Overrides:** None\n* **Implements:** None\n\n#### Analysis\n\nBased on the provided information, this Java method provides a basic implementation of the bubble sort algorithm, which is a simple sorting algorithm that repeatedly steps through the list, compares adjacent elements, and swaps them if they are in the wrong order.\n\nThe method takes an integer array as input and sorts it in ascending order. The `public` and `static` modifiers indicate that the method can be accessed from any class and does not require an instance of the enclosing class to be called.\n\nThe method dependencies indicate that the `bubbleSort` method does not call any other methods, use any fields, override any methods, or implement any interfaces.\n\n#### Example Use Cases\n\n* Sorting an array of integers in ascending order\n* Demonstrating the usage of bubble sort algorithm\n\n#### Code Improvements\n\n* Consider adding error handling for cases like null or empty arrays\n* Add comments to explain the implementation of the bubble sort algorithm\n* Consider adding more methods for array manipulation, such as searching or inserting elements\n\n#### Implementation Notes\n\nThe implementation of the `bubbleSort` method is not provided, so the analysis is based on the given information about the method structure and dependencies. A typical implementation of the bubble sort algorithm would involve nested loops to compare and swap adjacent elements in the array.\n\n#### Inherited Methods\n\nAs a method of the `code` class, which is a subclass of `Object`, this method inherits the following methods:\n\n* `toString`\n* `equals`\n* `hashCode`\n* `getClass`\n* `wait`\n* `notify`\n* `notifyAll`\n\nHowever, these methods are not directly related to the implementation of the `bubbleSort` method.\n\n#### Description\n\nThis method sorts an array using bubble sort. It takes an integer array as input, sorts it in ascending order using the bubble sort algorithm, and does not return any value. The method is public and static, making it accessible from any class without requiring an instance of the enclosing class."
    },
    {
      "method_name": "printArray",
      "modifiers": [
        "public",
        "static"
      ],
      "return_type": "void",
      "parameters": [
        {
          "name": "arr",
          "type": "int[]"
        }
      ],
      "throws": [],
      "enclosing_class": [
        "code"
      ],
      "dependencies": {
        "called_methods": [],
        "used_fields": [],
        "overrides": "",
        "implements": ""
      },
      "description": "This method prints the elements of an array.",
      "first_Pass_Analysis": "This Java method, `printArray`, is a public static void method that takes an integer array as input and prints its elements, providing basic array output functionality.",
      "second_Pass_Analysis": "### Detailed Analysis of the Java Method: `printArray`\n\n#### Overview\n\nThe provided Java method, `printArray`, is a public static void method that takes an integer array as input and prints its elements, providing basic array output functionality. This method is part of the `code` class and is used to display the contents of an array.\n\n#### Method Structure\n\n* **Method Name:** `printArray`\n* **Modifiers:** `public`, `static`\n* **Return Type:** `void`\n* **Parameters:** `arr: int[]`\n* **Throws:** None\n* **Enclosing Class:** `code`\n\n#### Method Dependencies\n\nThe `printArray` method has the following dependencies:\n\n* **Called Methods:** None\n* **Used Fields:** None\n* **Overrides:** None\n* **Implements:** None\n\n#### Analysis\n\nBased on the provided information, this Java method provides basic array output functionality by printing the elements of an array. The method takes an integer array as input and does not return any value.\n\nThe method dependencies indicate that the `printArray` method does not call any other methods, and it does not use any fields. This suggests that the method is self-contained and does not rely on any external dependencies.\n\n#### Example Use Cases\n\n* Printing the elements of an array after sorting\n* Displaying the contents of an array for debugging purposes\n* Providing output for array-based algorithms\n\n#### Code Improvements\n\n* Consider adding error handling for cases like null or empty arrays\n* Add support for printing arrays of different data types, such as strings or objects\n* Consider adding an optional parameter to specify the format of the output\n\n#### Implementation Notes\n\nThe implementation of the `printArray` method is not provided, but it is likely to involve a simple loop that iterates over the elements of the array and prints each element using `System.out.println()` or a similar method.\n\n#### Inherited Methods\n\nAs a static method of the `code` class, `printArray` inherits the following methods from the `Object` class:\n\n* `toString`\n* `equals`\n* `hashCode`\n* `getClass`\n* `wait`\n* `notify`\n* `notifyAll`\n\nHowever, these methods are not directly relevant to the implementation of the `printArray` method.\n\n#### Description\n\nThis method prints the elements of an array, providing basic array output functionality. It is a public static void method that takes an integer array as input and does not return any value. The method is self-contained and does not rely on any external dependencies."
    },
    {
      "method_name": "main",
      "modifiers": [
        "public",
        "static"
      ],
      "return_type": "void",
      "parameters": [
        {
          "name": "args",
          "type": "String[]"
        }
      ],
      "throws": [],
      "enclosing_class": [
        "code"
      ],
      "dependencies": {
        "called_methods": [
          "printArray",
          "bubbleSort"
        ],
        "used_fields": [],
        "overrides": "",
        "implements": ""
      },
      "description": "This is the main method where the program starts execution.",
      "first_Pass_Analysis": "The `main` method is the program's entry point, initiating execution with a `public static void` signature, taking a `String[]` parameter, and residing within the `code` class.",
      "second_Pass_Analysis": "### Detailed Analysis of the Java Method: `main`\n\n#### Overview\n\nThe provided Java method, `main`, is the program's entry point, initiating execution with a `public static void` signature, taking a `String[]` parameter, and residing within the `code` class. This method is responsible for starting the program's execution and calling other methods to perform specific tasks.\n\n#### Method Structure\n\n* **Method Name:** `main`\n* **Modifiers:** `public`, `static`\n* **Return Type:** `void`\n* **Parameters:** `args: String[]`\n* **Throws:** None\n* **Enclosing Class:** `code`\n\n#### Method Dependencies\n\nThe `main` method has the following dependencies:\n\n* **Called Methods:** \n\t+ `printArray`: prints the elements of an array\n\t+ `bubbleSort`: sorts an array using the bubble sort algorithm\n* **Used Fields:** None\n* **Overrides:** None\n* **Implements:** None\n\n#### Analysis\n\nBased on the provided information, this Java method serves as the entry point of the program, initiating execution and calling other methods to perform specific tasks. The method takes a `String[]` parameter, which is typically used to pass command-line arguments to the program.\n\nThe method dependencies indicate that the `main` method calls both `printArray` and `bubbleSort` methods, suggesting that the program is designed to perform array manipulation tasks, such as sorting and printing arrays.\n\n#### Example Use Cases\n\n* Starting the program's execution and calling other methods to perform specific tasks\n* Passing command-line arguments to the program using the `args` parameter\n* Demonstrating the usage of array manipulation methods, such as `printArray` and `bubbleSort`\n\n#### Code Improvements\n\n* Consider adding error handling for cases like invalid command-line arguments\n* Add support for passing different types of arguments, such as integers or objects\n* Consider adding an optional parameter to specify the format of the output\n\n#### Implementation Notes\n\nThe implementation of the `main` method is not provided, but it is likely to involve calling the `printArray` and `bubbleSort` methods, as well as any other necessary methods to perform the program's tasks.\n\n#### Inherited Methods\n\nAs a static method of the `code` class, `main` inherits the following methods from the `Object` class:\n\n* `toString`\n* `equals`\n* `hashCode`\n* `getClass`\n* `wait`\n* `notify`\n* `notifyAll`\n\nHowever, these methods are not directly relevant to the implementation of the `main` method.\n\n#### Description\n\nThis method is the program's entry point, initiating execution and calling other methods to perform specific tasks. It is a public static void method that takes a `String[]` parameter and does not return any value. The method is responsible for starting the program's execution and demonstrating the usage of array manipulation methods."
    }
  ],
  "constructors": [],
  "fields": []
}